{"schema":"oreflow.benchmark/v2","engine_version":"0.10.004","contract_digest":"0d2b65d272f3abcc6adffbf0f734c985cb002ab5cb665c109b8e8e9e31cecbd7","protocol":"12 authored cases with 8 variants each (the nominal state, single-factor changes and the cut mode), simulated by the steady-state engine; oracles are published examples, not plant data; the learned lane is scored by interpolation, one case out and one ore group out on engine states.","case_count":12,"variant_count":96,"cases":[{"case_id":"copper_porphyry_soft","family":"rougher","category":"liberation","kpis":{"recovery_pct":{"value":92.21261928007924,"range":[90.0,96.0],"within":true,"source":{"en":"Over 90% of the sulphide copper can be recovered in normal porphyry practice (911metallurgist practice summary, secondary source); the 96% ceiling is authored.","es":"En la práctica normal de pórfidos es posible recuperar más de 90% del cobre sulfurado (resumen de práctica de 911metallurgist, fuente secundaria); el techo de 96% es de autor."},"basis":"authored_bound"},"concentrate_grade":{"value":26.415673447496314,"range":[25.0,34.6],"within":true,"source":{"en":"From 25% Cu, the floor of the grades a copper-concentrate purchase schedule covers (Kroha and Wesis 1985: 25 to 35% Cu), to 34.6% Cu, the stoichiometric limit of chalcopyrite.","es":"Desde 25% Cu, el piso de las leyes que cubre un programa de compra de concentrados de cobre (Kroha y Wesis 1985: 25 a 35% Cu), hasta 34,6% Cu, el límite estequiométrico de la calcopirita."},"basis":"cited"}},"variants":{"nominal":{"recovery_pct":92.21261928007924,"concentrate_grade":26.415673447496314,"head_grade":0.7400000000000002,"recovered_primary_tph":4.913088355242623,"specific_energy_total_kwh_t":10.394628844259875,"mill_power_kw":6456.494528849473,"p80_um":149.99999999999997,"water_intensity_m3_t":2.174073650284901,"power_limited":false,"flags":[],"balance_max_relative_error":1.5256931520626593e-13},"harder_ore":{"recovery_pct":88.34701637599348,"concentrate_grade":25.729179011750663,"head_grade":0.7400000000000002,"recovered_primary_tph":4.707129032512933,"specific_energy_total_kwh_t":11.696032477414686,"mill_power_kw":7269.999999999997,"p80_um":176.9876903807688,"water_intensity_m3_t":2.172358056213126,"power_limited":true,"flags":["power_limited"],"balance_max_relative_error":1.1881853525766117e-13},"coarser_grind":{"recovery_pct":85.18068544318821,"concentrate_grade":25.90988454403828,"head_grade":0.7400000000000002,"recovered_primary_tph":4.538426920413069,"specific_energy_total_kwh_t":8.782062168507633,"mill_power_kw":5342.923180991101,"p80_um":202.5000000000017,"water_intensity_m3_t":2.1662154343708835,"power_limited":false,"flags":[],"balance_max_relative_error":1.3697684961597485e-13},"higher_throughput":{"recovery_pct":86.42569815286615,"concentrate_grade":26.54460389631719,"head_grade":0.7400000000000004,"recovered_primary_tph":5.755951496980888,"specific_energy_total_kwh_t":9.387828075199621,"mill_power_kw":7270.0,"p80_um":176.98769038076867,"water_intensity_m3_t":2.175301637777683,"power_limited":true,"flags":["power_limited"],"balance_max_relative_error":8.479143313403862e-14},"more_collector":{"recovery_pct":93.16232919266626,"concentrate_grade":25.68023584671239,"head_grade":0.7400000000000002,"recovered_primary_tph":4.96368889938526,"specific_energy_total_kwh_t":10.434104198743798,"mill_power_kw":6456.494528849473,"p80_um":149.99999999999997,"water_intensity_m3_t":2.182341929852703,"power_limited":false,"flags":[],"balance_max_relative_error":1.5217456924195475e-13},"more_air":{"recovery_pct":93.3431844075376,"concentrate_grade":26.562816182795313,"head_grade":0.7400000000000002,"recovered_primary_tph":4.973324865233605,"specific_energy_total_kwh_t":10.48231286488869,"mill_power_kw":6456.494528849473,"p80_um":149.99999999999997,"water_intensity_m3_t":2.17519071102068,"power_limited":false,"flags":[],"balance_max_relative_error":1.53950926081355e-13},"cut_nominal":{"recovery_pct":93.5841543710521,"concentrate_grade":26.755123753282483,"head_grade":0.7400000000000002,"recovered_primary_tph":4.986163744889657,"specific_energy_total_kwh_t":11.555662684436854,"mill_power_kw":7270.000000000227,"p80_um":135.60677894155552,"water_intensity_m3_t":2.1747430833112356,"power_limited":false,"flags":[],"balance_max_relative_error":1.5375355309919943e-13},"cut_finer":{"recovery_pct":95.49610899992393,"concentrate_grade":26.832379986709736,"head_grade":0.7400000000000002,"recovered_primary_tph":5.088032687515948,"specific_energy_total_kwh_t":11.566222100613524,"mill_power_kw":7269.999999999817,"p80_um":122.31742373256344,"water_intensity_m3_t":2.176784675242583,"power_limited":false,"flags":[],"balance_max_relative_error":1.6381957518913417e-13}}},{"case_id":"copper_porphyry_hard","family":"rougher","category":"liberation","kpis":{"recovery_pct":{"value":93.27399826596478,"range":[90.0,96.0],"within":true,"source":{"en":"Over 90% of the sulphide copper can be recovered in normal porphyry practice (911metallurgist practice summary, secondary source); the 96% ceiling is authored.","es":"En la práctica normal de pórfidos es posible recuperar más de 90% del cobre sulfurado (resumen de práctica de 911metallurgist, fuente secundaria); el techo de 96% es de autor."},"basis":"authored_bound"},"concentrate_grade":{"value":26.169356623036133,"range":[25.0,34.6],"within":true,"source":{"en":"From 25% Cu, the floor of the grades a copper-concentrate purchase schedule covers (Kroha and Wesis 1985: 25 to 35% Cu), to 34.6% Cu, the stoichiometric limit of chalcopyrite.","es":"Desde 25% Cu, el piso de las leyes que cubre un programa de compra de concentrados de cobre (Kroha y Wesis 1985: 25 a 35% Cu), hasta 34,6% Cu, el límite estequiométrico de la calcopirita."},"basis":"cited"}},"variants":{"nominal":{"recovery_pct":93.27399826596478,"concentrate_grade":26.169356623036133,"head_grade":0.5199999999999999,"recovered_primary_tph":2.473626434013386,"specific_energy_total_kwh_t":16.128598092408794,"mill_power_kw":7239.203672413863,"p80_um":165.00000000000082,"water_intensity_m3_t":2.1391195822078704,"power_limited":false,"flags":[],"balance_max_relative_error":1.2385735139033902e-13},"harder_ore":{"recovery_pct":85.04721896402694,"concentrate_grade":25.4284969118535,"head_grade":0.5199999999999999,"recovered_primary_tph":2.2554522469259943,"specific_energy_total_kwh_t":16.63918302856264,"mill_power_kw":7360.0,"p80_um":229.1936432399208,"water_intensity_m3_t":2.1327886088529087,"power_limited":true,"flags":["power_limited"],"balance_max_relative_error":1.1257226088120803e-13},"coarser_grind":{"recovery_pct":86.24696788392342,"concentrate_grade":25.721762032363298,"head_grade":0.5199999999999999,"recovered_primary_tph":2.2872695882816494,"specific_energy_total_kwh_t":13.621258112269354,"mill_power_kw":5994.9695221519405,"p80_um":222.74999999989996,"water_intensity_m3_t":2.1329222544044284,"power_limited":false,"flags":[],"balance_max_relative_error":1.8139738077640206e-13},"higher_throughput":{"recovery_pct":83.25144731538673,"concentrate_grade":26.25703457810744,"head_grade":0.5199999999999999,"recovered_primary_tph":2.7597854785050697,"specific_energy_total_kwh_t":13.330307992624931,"mill_power_kw":7359.999999999998,"p80_um":229.1936432399206,"water_intensity_m3_t":2.137340715324129,"power_limited":true,"flags":["power_limited"],"balance_max_relative_error":4.7146600349258415e-14},"more_collector":{"recovery_pct":94.08774247993881,"concentrate_grade":25.013045894484648,"head_grade":0.5199999999999999,"recovered_primary_tph":2.4952069305679774,"specific_energy_total_kwh_t":16.168950783172924,"mill_power_kw":7239.203672413863,"p80_um":165.00000000000082,"water_intensity_m3_t":2.1466855641388767,"power_limited":false,"flags":[],"balance_max_relative_error":2.6206487960093107e-13},"more_air":{"recovery_pct":94.19605018832385,"concentrate_grade":26.244755060634212,"head_grade":0.5199999999999999,"recovered_primary_tph":2.4980792509943486,"specific_energy_total_kwh_t":16.215232985262926,"mill_power_kw":7239.203672413863,"p80_um":165.00000000000082,"water_intensity_m3_t":2.1399453727654554,"power_limited":false,"flags":[],"balance_max_relative_error":2.564919953988911e-13},"cut_nominal":{"recovery_pct":93.47177430662033,"concentrate_grade":26.210044594181337,"head_grade":0.5199999999999999,"recovered_primary_tph":2.4788714546115713,"specific_energy_total_kwh_t":16.370314153575002,"mill_power_kw":7360.000000000354,"p80_um":162.70401829928653,"water_intensity_m3_t":2.139267381453085,"power_limited":false,"flags":[],"balance_max_relative_error":1.2455396191559404e-13},"cut_finer":{"recovery_pct":95.62140393153786,"concentrate_grade":26.256893064728676,"head_grade":0.5199999999999999,"recovered_primary_tph":2.535879632264384,"specific_energy_total_kwh_t":16.3799003801493,"mill_power_kw":7360.000000000184,"p80_um":146.9675188955962,"water_intensity_m3_t":2.1411348656271842,"power_limited":false,"flags":["circulating_load_out_of_range"],"balance_max_relative_error":9.864005037610803e-14}}},{"case_id":"gold_free_milling","family":"gravity_rougher","category":"classification","kpis":{"recovery_pct":{"value":97.4966323815073,"range":[85.0,98.0],"within":true,"source":{"en":"Authored. In an earlier case record the ceiling was 97%; the rebuilt gravity model recovers coarse gold that flotation partly missed, and the nominal state moved to about 97.7%. Secondary reports of gravity plus flotation tests give 93.6 to 95.6% (unverified), so this case is on the optimistic side.","es":"De autor. En un registro anterior el techo era 97%; el modelo gravimétrico reconstruido recupera oro grueso que la flotación perdía en parte, y el estado nominal pasó a cerca de 97,7%. Reportes secundarios de pruebas de gravedad más flotación dan 93,6 a 95,6% (sin verificar), así que este caso queda del lado optimista."},"basis":"authored"},"gravity_recovery_pct":{"value":27.015115357876684,"range":[15.0,30.0],"within":true,"source":{"en":"A plant recovers about a third to